{
  "spec_version": "1.0.0",
  "kind": "agent_manifest",
  "manifest_id": "amf_v2",
  "agent_name": "demo",
  "version_label": "v2",
  "created_at": "2026-05-12T00:00:00Z",
  "identity": {
    "overall_hash": "sha256:base",
    "hash_algorithm": "jcs-sha256"
  },
  "contract": {
    "prompt_stack": {
      "system_prompt": {
        "id": "prompt_system",
        "version": "1",
        "hash": "sha256:sp1"
      },
      "reasoning_policy": "hidden"
    },
    "model_runtime": {
      "provider": "openai",
      "model": "gpt-4o"
    },
    "tool_registry": {
      "registry_version": "1",
      "registry_hash": "sha256:reg",
      "tools": [
        {
          "name": "search",
          "version": "1",
          "hash": "sha256:t1",
          "input_schema_hash": "sha256:t1i",
          "output_schema_hash": "sha256:t1o"
        }
      ]
    },
    "skill_registry": {
      "registry_version": "1",
      "registry_hash": "sha256:sk2",
      "selection_strategy": "llm_semantic",
      "skills": [
        {
          "name": "summarize",
          "version": "1",
          "hash": "sha256:s1"
        }
      ]
    },
    "workflow": {
      "graph_name": "g",
      "graph_version": "1",
      "graph_hash": "sha256:g1"
    },
    "subagents": [],
    "output_contract": {
      "version": "1",
      "schema_hash": "sha256:o1",
      "format": "text",
      "strict": false
    },
    "environment": {
      "deployment_id": "dep_1",
      "region": "us-east-1"
    }
  },
  "extensions": {}
}
