{
  "spec_version": "1.0.0",
  "kind": "agent_manifest",
  "manifest_id": "amf_01KZWEB6H8AHE7V9SEY53NJPJ3",
  "agent_name": "demo",
  "version_label": "v2",
  "created_at": "2026-05-12T00:00:00Z",
  "identity": {
    "overall_hash": "sha256:96a122ab9833c86f29ee89a2b20193a38cc7f10ca338ee34c00611db333251c7",
    "hash_algorithm": "jcs-sha256"
  },
  "contract": {
    "prompt_stack": {
      "reasoning_policy": "hidden"
    },
    "model_runtime": {
      "provider": "openai",
      "model": "gpt-4o"
    },
    "tool_registry": {
      "registry_version": "1",
      "registry_hash": "sha256:reg",
      "tools": [
        {
          "name": "get_population",
          "version": "1",
          "hash": "sha256:p2",
          "input_schema_hash": "sha256:p1i",
          "output_schema_hash": "sha256:p1o"
        }
      ]
    },
    "workflow": {
      "graph_name": "g",
      "graph_version": "1"
    },
    "subagents": [],
    "output_contract": {
      "version": "1",
      "schema_hash": "sha256:o1",
      "format": "text",
      "strict": false
    }
  },
  "extensions": {}
}