{
  "spec_version": "1.0.0",
  "kind": "agent_manifest",
  "manifest_id": "amf_v1",
  "agent_name": "demo",
  "version_label": "v1",
  "created_at": "2026-05-12T00:00:00Z",
  "identity": {
    "overall_hash": "sha256:9d02a3aab43e21589154ac6a238c339a8b9c3d8ee8364413e9da35cbf209af8e",
    "hash_algorithm": "jcs-sha256"
  },
  "contract": {
    "prompt_stack": {
      "reasoning_policy": "hidden"
    },
    "model_runtime": {
      "provider": "openai",
      "model": "gpt-4o"
    },
    "tool_registry": {
      "registry_version": "1",
      "registry_hash": "sha256:reg",
      "tools": [
        {
          "name": "search_population",
          "version": "1",
          "hash": "sha256:p1",
          "input_schema_hash": "sha256:p1i",
          "output_schema_hash": "sha256:p1o"
        }
      ]
    },
    "workflow": {
      "graph_name": "g",
      "graph_version": "1"
    },
    "subagents": [],
    "output_contract": {
      "version": "1",
      "schema_hash": "sha256:o1",
      "format": "text",
      "strict": false
    }
  },
  "extensions": {}
}