{
  "spec_version": "1.0.0",
  "kind": "agent_manifest",
  "manifest_id": "amf_01KZWEB6GMW2M7YPH5TRC8GC04",
  "agent_name": "demo",
  "version_label": "v2",
  "created_at": "2026-05-12T00:00:00Z",
  "identity": {
    "overall_hash": "sha256:2c232b3cf0df0270c0d9b2909e1e56476b434ab6d13f0403093b579b6e622b77",
    "hash_algorithm": "jcs-sha256"
  },
  "contract": {
    "prompt_stack": {
      "reasoning_policy": "hidden"
    },
    "model_runtime": {
      "provider": "openai",
      "model": "gpt-4o"
    },
    "tool_registry": {
      "registry_version": "1",
      "registry_hash": "sha256:reg",
      "tools": [
        {
          "name": "search",
          "version": "1",
          "hash": "sha256:s1",
          "input_schema_hash": "sha256:si1",
          "output_schema_hash": "sha256:so1"
        }
      ]
    },
    "workflow": {
      "graph_name": "g",
      "graph_version": "1"
    },
    "subagents": [],
    "output_contract": {
      "version": "1",
      "schema_hash": "sha256:new_schema",
      "format": "json",
      "strict": false
    }
  },
  "extensions": {}
}