{
  "spec_version": "1.0.0",
  "kind": "agent_manifest",
  "manifest_id": "amf_v1",
  "agent_name": "demo",
  "version_label": "v1",
  "created_at": "2026-05-12T00:00:00Z",
  "identity": {
    "overall_hash": "sha256:61adcffa5284fe278f81b31865bba2bf1ddb37b20ac584fb61b95a793965da33",
    "hash_algorithm": "jcs-sha256"
  },
  "contract": {
    "prompt_stack": {
      "reasoning_policy": "hidden"
    },
    "model_runtime": {
      "provider": "openai",
      "model": "gpt-4o"
    },
    "tool_registry": {
      "registry_version": "1",
      "registry_hash": "sha256:reg",
      "tools": [
        {
          "name": "search",
          "version": "1",
          "hash": "sha256:s1",
          "input_schema_hash": "sha256:si1",
          "output_schema_hash": "sha256:so1"
        }
      ]
    },
    "workflow": {
      "graph_name": "g",
      "graph_version": "1"
    },
    "subagents": [],
    "output_contract": {
      "version": "1",
      "schema_hash": "sha256:old_schema",
      "format": "text",
      "strict": false
    }
  },
  "extensions": {}
}